{
  "candidate_status": "success",
  "checks_path": "objective_report.json",
  "computed_at": "2026-08-06T15:05:21.584866Z",
  "contract_sha256": "b113743f47bbea4f3df8e13c93961071d1a1787243c1a857b4226b79c8acc4ee",
  "dimensions": [
    {
      "dimension_id": "scientific_credibility",
      "direction": "higher_better",
      "metrics": [
        {
          "direction": "higher_better",
          "evidence": [
            "llm_grader_report.json"
          ],
          "expected": 8.0,
          "metric_id": "llm.source_specific",
          "normalized_score": 75.0,
          "passed": false,
          "reason": "CSV rows instantiate the task-supplied source rules exactly (DL=absolute value for non-sentinel negatives, sentinel mapped to not_analyzed), showing the negative semantics were treated as source-rule-driven, and no generalization to all databases appears anywhere; however, no explicit written statement attributing the semantics to the source rules exists in the provided evidence, so full credit is not met.",
          "status": "scored",
          "value": 6.0,
          "weight": 1.0
        }
      ],
      "score": 75.0,
      "weight": 0.25
    },
    {
      "dimension_id": "engineering_quality",
      "direction": "higher_better",
      "metrics": [
        {
          "direction": "pass_fail",
          "evidence": [
            "objective_report.json"
          ],
          "expected": 5.0,
          "metric_id": "objective.output_exists",
          "normalized_score": 100.0,
          "passed": true,
          "reason": null,
          "status": "scored",
          "value": 5.0,
          "weight": 1.0
        }
      ],
      "score": 100.0,
      "weight": 0.3
    },
    {
      "dimension_id": "platform_reusability",
      "direction": "higher_better",
      "metrics": [
        {
          "direction": "pass_fail",
          "evidence": [
            "objective_report.json"
          ],
          "expected": 8.0,
          "metric_id": "objective.columns",
          "normalized_score": 100.0,
          "passed": true,
          "reason": null,
          "status": "scored",
          "value": 8.0,
          "weight": 1.0
        }
      ],
      "score": 100.0,
      "weight": 0.14
    },
    {
      "dimension_id": "domain_understanding",
      "direction": "higher_better",
      "metrics": [
        {
          "direction": "pass_fail",
          "evidence": [
            "objective_report.json"
          ],
          "expected": 5.0,
          "metric_id": "objective.row_count",
          "normalized_score": 100.0,
          "passed": true,
          "reason": null,
          "status": "scored",
          "value": 5.0,
          "weight": 0.063291139241
        },
        {
          "direction": "pass_fail",
          "evidence": [
            "objective_report.json"
          ],
          "expected": 8.0,
          "metric_id": "objective.u01_numeric_empty",
          "normalized_score": 100.0,
          "passed": true,
          "reason": null,
          "status": "scored",
          "value": 8.0,
          "weight": 0.101265822785
        },
        {
          "direction": "pass_fail",
          "evidence": [
            "objective_report.json"
          ],
          "expected": 10.0,
          "metric_id": "objective.u01_dl",
          "normalized_score": 100.0,
          "passed": true,
          "reason": null,
          "status": "scored",
          "value": 10.0,
          "weight": 0.126582278481
        },
        {
          "direction": "pass_fail",
          "evidence": [
            "objective_report.json"
          ],
          "expected": 12.0,
          "metric_id": "objective.u02_sentinel",
          "normalized_score": 100.0,
          "passed": true,
          "reason": null,
          "status": "scored",
          "value": 12.0,
          "weight": 0.151898734177
        },
        {
          "direction": "pass_fail",
          "evidence": [
            "objective_report.json"
          ],
          "expected": 7.0,
          "metric_id": "objective.u02_not_eligible",
          "normalized_score": 100.0,
          "passed": true,
          "reason": null,
          "status": "scored",
          "value": 7.0,
          "weight": 0.088607594937
        },
        {
          "direction": "pass_fail",
          "evidence": [
            "objective_report.json"
          ],
          "expected": 8.0,
          "metric_id": "objective.u03_value",
          "normalized_score": 100.0,
          "passed": true,
          "reason": null,
          "status": "scored",
          "value": 8.0,
          "weight": 0.101265822785
        },
        {
          "direction": "pass_fail",
          "evidence": [
            "objective_report.json"
          ],
          "expected": 8.0,
          "metric_id": "objective.u04_bound",
          "normalized_score": 100.0,
          "passed": true,
          "reason": null,
          "status": "scored",
          "value": 8.0,
          "weight": 0.101265822785
        },
        {
          "direction": "pass_fail",
          "evidence": [
            "objective_report.json"
          ],
          "expected": 5.0,
          "metric_id": "objective.u04_qualifier",
          "normalized_score": 100.0,
          "passed": true,
          "reason": null,
          "status": "scored",
          "value": 5.0,
          "weight": 0.063291139241
        },
        {
          "direction": "pass_fail",
          "evidence": [
            "objective_report.json"
          ],
          "expected": 4.0,
          "metric_id": "objective.u05_missing",
          "normalized_score": 100.0,
          "passed": true,
          "reason": null,
          "status": "scored",
          "value": 4.0,
          "weight": 0.050632911392
        },
        {
          "direction": "higher_better",
          "evidence": [
            "llm_grader_report.json"
          ],
          "expected": 6.0,
          "metric_id": "llm.sentinel",
          "normalized_score": 100.0,
          "passed": true,
          "reason": "-9999 is isolated as a not_analyzed sentinel (not censored, no detection limit) while the non-sentinel negative -0.5 is handled as left-censored with DL=0.5, demonstrating correct separation.",
          "status": "scored",
          "value": 6.0,
          "weight": 0.075949367089
        },
        {
          "direction": "higher_better",
          "evidence": [
            "llm_grader_report.json"
          ],
          "expected": 6.0,
          "metric_id": "llm.bounds",
          "normalized_score": 100.0,
          "passed": true,
          "reason": "Both the lower detection bound (U01) and the upper limit from source code G (U04, converted to '>') are stored only in bound_value with numeric_value left empty and eligible_quantitative=False, so bounds are never treated as exact concentrations; reported values preserved without substitution.",
          "status": "scored",
          "value": 6.0,
          "weight": 0.075949367089
        }
      ],
      "score": 100.0,
      "weight": 0.15
    },
    {
      "dimension_id": "innovation_ecosystem",
      "direction": "higher_better",
      "metrics": [
        {
          "direction": "pass_fail",
          "evidence": [
            "objective_report.json"
          ],
          "expected": true,
          "metric_id": "innovation_ecosystem.missing_evidence",
          "normalized_score": null,
          "passed": null,
          "reason": "No frozen metric evidence was supplied for this E1 dimension.",
          "status": "not_scored",
          "value": null,
          "weight": 1.0
        }
      ],
      "score": 0.0,
      "weight": 0.1
    },
    {
      "dimension_id": "open_source_potential",
      "direction": "higher_better",
      "metrics": [
        {
          "direction": "pass_fail",
          "evidence": [
            "objective_report.json"
          ],
          "expected": true,
          "metric_id": "open_source_potential.missing_evidence",
          "normalized_score": null,
          "passed": null,
          "reason": "No frozen metric evidence was supplied for this E1 dimension.",
          "status": "not_scored",
          "value": null,
          "weight": 1.0
        }
      ],
      "score": 0.0,
      "weight": 0.06
    }
  ],
  "eval_version": "1.0.0",
  "evidence": [
    "llm_grader_report.json",
    "objective_report.json"
  ],
  "hard_gate_passed": true,
  "rubric_sha256": "7ed0268be273f0d43212914ac695ecbf7a1ae95a57f27e2ab71c0f59cf70f963",
  "run_id": "regression-q18-independent-review",
  "schema_version": "1.0.0",
  "score_status": "partial",
  "scorer_version": "6.0.0",
  "total_score": 77.75
}
