{
  "candidate_status": "success",
  "checks_path": "objective_report.json",
  "computed_at": "2026-08-06T15:05:19.479525Z",
  "contract_sha256": "b113743f47bbea4f3df8e13c93961071d1a1787243c1a857b4226b79c8acc4ee",
  "dimensions": [
    {
      "dimension_id": "scientific_credibility",
      "direction": "higher_better",
      "metrics": [
        {
          "direction": "higher_better",
          "evidence": [
            "llm_grader_report.json"
          ],
          "expected": 8.0,
          "metric_id": "llm.traceability",
          "normalized_score": 100.0,
          "passed": true,
          "reason": "Every row S01-S06 keeps original_value, original_unit and the frozen conversion_rule alongside normalized_value/normalized_unit, and each normalized value is arithmetically derivable from its row's original value and rule; row-level traceability is complete and consistent with the checker report.",
          "status": "scored",
          "value": 8.0,
          "weight": 1.0
        }
      ],
      "score": 100.0,
      "weight": 0.25
    },
    {
      "dimension_id": "engineering_quality",
      "direction": "higher_better",
      "metrics": [
        {
          "direction": "pass_fail",
          "evidence": [
            "objective_report.json"
          ],
          "expected": 5.0,
          "metric_id": "objective.output_exists",
          "normalized_score": 100.0,
          "passed": true,
          "reason": null,
          "status": "scored",
          "value": 5.0,
          "weight": 1.0
        }
      ],
      "score": 100.0,
      "weight": 0.3
    },
    {
      "dimension_id": "platform_reusability",
      "direction": "higher_better",
      "metrics": [
        {
          "direction": "pass_fail",
          "evidence": [
            "objective_report.json"
          ],
          "expected": 10.0,
          "metric_id": "objective.columns",
          "normalized_score": 100.0,
          "passed": true,
          "reason": null,
          "status": "scored",
          "value": 10.0,
          "weight": 1.0
        }
      ],
      "score": 100.0,
      "weight": 0.14
    },
    {
      "dimension_id": "domain_understanding",
      "direction": "higher_better",
      "metrics": [
        {
          "direction": "pass_fail",
          "evidence": [
            "objective_report.json"
          ],
          "expected": 5.0,
          "metric_id": "objective.row_count",
          "normalized_score": 100.0,
          "passed": true,
          "reason": null,
          "status": "scored",
          "value": 5.0,
          "weight": 0.064935064935
        },
        {
          "direction": "pass_fail",
          "evidence": [
            "objective_report.json"
          ],
          "expected": 6.0,
          "metric_id": "objective.key_set",
          "normalized_score": 100.0,
          "passed": true,
          "reason": null,
          "status": "scored",
          "value": 6.0,
          "weight": 0.077922077922
        },
        {
          "direction": "pass_fail",
          "evidence": [
            "objective_report.json"
          ],
          "expected": 6.0,
          "metric_id": "objective.s01_value",
          "normalized_score": 100.0,
          "passed": true,
          "reason": null,
          "status": "scored",
          "value": 6.0,
          "weight": 0.077922077922
        },
        {
          "direction": "pass_fail",
          "evidence": [
            "objective_report.json"
          ],
          "expected": 6.0,
          "metric_id": "objective.s02_value",
          "normalized_score": 100.0,
          "passed": true,
          "reason": null,
          "status": "scored",
          "value": 6.0,
          "weight": 0.077922077922
        },
        {
          "direction": "pass_fail",
          "evidence": [
            "objective_report.json"
          ],
          "expected": 6.0,
          "metric_id": "objective.s03_value",
          "normalized_score": 100.0,
          "passed": true,
          "reason": null,
          "status": "scored",
          "value": 6.0,
          "weight": 0.077922077922
        },
        {
          "direction": "pass_fail",
          "evidence": [
            "objective_report.json"
          ],
          "expected": 6.0,
          "metric_id": "objective.s04_value",
          "normalized_score": 100.0,
          "passed": true,
          "reason": null,
          "status": "scored",
          "value": 6.0,
          "weight": 0.077922077922
        },
        {
          "direction": "pass_fail",
          "evidence": [
            "objective_report.json"
          ],
          "expected": 6.0,
          "metric_id": "objective.s05_value",
          "normalized_score": 100.0,
          "passed": true,
          "reason": null,
          "status": "scored",
          "value": 6.0,
          "weight": 0.077922077922
        },
        {
          "direction": "pass_fail",
          "evidence": [
            "objective_report.json"
          ],
          "expected": 6.0,
          "metric_id": "objective.s06_value",
          "normalized_score": 100.0,
          "passed": true,
          "reason": null,
          "status": "scored",
          "value": 6.0,
          "weight": 0.077922077922
        },
        {
          "direction": "pass_fail",
          "evidence": [
            "objective_report.json"
          ],
          "expected": 10.0,
          "metric_id": "objective.original_values",
          "normalized_score": 100.0,
          "passed": true,
          "reason": null,
          "status": "scored",
          "value": 10.0,
          "weight": 0.12987012987
        },
        {
          "direction": "pass_fail",
          "evidence": [
            "objective_report.json"
          ],
          "expected": 8.0,
          "metric_id": "objective.conversion_rules",
          "normalized_score": 100.0,
          "passed": true,
          "reason": null,
          "status": "scored",
          "value": 8.0,
          "weight": 0.103896103896
        },
        {
          "direction": "higher_better",
          "evidence": [
            "llm_grader_report.json"
          ],
          "expected": 8.0,
          "metric_id": "llm.basis_scope",
          "normalized_score": 100.0,
          "passed": true,
          "reason": "All six rows apply the frozen mass/mass-qualified conversion-rule strings (mass_mass qualifiers on ppm and ppb rules; wt%, ug/g, g/kg are inherently mass/mass units) consistently to solid soil records, encoding that the equivalences hold under the task-fixed solid mass/mass basis; machine report conversion_rules check passed with missing terms=[].",
          "status": "scored",
          "value": 8.0,
          "weight": 0.103896103896
        },
        {
          "direction": "higher_better",
          "evidence": [
            "llm_grader_report.json"
          ],
          "expected": 4.0,
          "metric_id": "llm.precision",
          "normalized_score": 100.0,
          "passed": true,
          "reason": "All converted values are exact (e.g., 0.012 wt% -> 120, 8000 ppb -> 8, 0.4 g/kg -> 400) with no premature rounding; every cell check passed at absolute tolerance 1e-06, so no order-of-magnitude-distorting rounding occurred.",
          "status": "scored",
          "value": 4.0,
          "weight": 0.051948051948
        }
      ],
      "score": 100.0,
      "weight": 0.15
    },
    {
      "dimension_id": "innovation_ecosystem",
      "direction": "higher_better",
      "metrics": [
        {
          "direction": "pass_fail",
          "evidence": [
            "objective_report.json"
          ],
          "expected": true,
          "metric_id": "innovation_ecosystem.missing_evidence",
          "normalized_score": null,
          "passed": null,
          "reason": "No frozen metric evidence was supplied for this E1 dimension.",
          "status": "not_scored",
          "value": null,
          "weight": 1.0
        }
      ],
      "score": 0.0,
      "weight": 0.1
    },
    {
      "dimension_id": "open_source_potential",
      "direction": "higher_better",
      "metrics": [
        {
          "direction": "pass_fail",
          "evidence": [
            "objective_report.json"
          ],
          "expected": true,
          "metric_id": "open_source_potential.missing_evidence",
          "normalized_score": null,
          "passed": null,
          "reason": "No frozen metric evidence was supplied for this E1 dimension.",
          "status": "not_scored",
          "value": null,
          "weight": 1.0
        }
      ],
      "score": 0.0,
      "weight": 0.06
    }
  ],
  "eval_version": "1.0.0",
  "evidence": [
    "llm_grader_report.json",
    "objective_report.json"
  ],
  "hard_gate_passed": true,
  "rubric_sha256": "4d48abb607aded799ab7ba76160cc254bad6e75372510ed8df46b5bc39e2a261",
  "run_id": "regression-q03-independent-review",
  "schema_version": "1.0.0",
  "score_status": "partial",
  "scorer_version": "6.0.0",
  "total_score": 84.0
}
