{
  "candidate_status": "success",
  "checks_path": "objective_report.json",
  "computed_at": "2026-08-06T15:05:20.375497Z",
  "contract_sha256": "b113743f47bbea4f3df8e13c93961071d1a1787243c1a857b4226b79c8acc4ee",
  "dimensions": [
    {
      "dimension_id": "scientific_credibility",
      "direction": "higher_better",
      "metrics": [
        {
          "direction": "pass_fail",
          "evidence": [
            "objective_report.json"
          ],
          "expected": true,
          "metric_id": "scientific_credibility.missing_evidence",
          "normalized_score": null,
          "passed": null,
          "reason": "No frozen metric evidence was supplied for this E1 dimension.",
          "status": "not_scored",
          "value": null,
          "weight": 1.0
        }
      ],
      "score": 0.0,
      "weight": 0.25
    },
    {
      "dimension_id": "engineering_quality",
      "direction": "higher_better",
      "metrics": [
        {
          "direction": "pass_fail",
          "evidence": [
            "objective_report.json"
          ],
          "expected": 4.0,
          "metric_id": "objective.observations_exists",
          "normalized_score": 100.0,
          "passed": true,
          "reason": null,
          "status": "scored",
          "value": 4.0,
          "weight": 0.5
        },
        {
          "direction": "pass_fail",
          "evidence": [
            "objective_report.json"
          ],
          "expected": 4.0,
          "metric_id": "objective.summary_exists",
          "normalized_score": 100.0,
          "passed": true,
          "reason": null,
          "status": "scored",
          "value": 4.0,
          "weight": 0.5
        }
      ],
      "score": 100.0,
      "weight": 0.3
    },
    {
      "dimension_id": "platform_reusability",
      "direction": "higher_better",
      "metrics": [
        {
          "direction": "pass_fail",
          "evidence": [
            "objective_report.json"
          ],
          "expected": true,
          "metric_id": "platform_reusability.missing_evidence",
          "normalized_score": null,
          "passed": null,
          "reason": "No frozen metric evidence was supplied for this E1 dimension.",
          "status": "not_scored",
          "value": null,
          "weight": 1.0
        }
      ],
      "score": 0.0,
      "weight": 0.14
    },
    {
      "dimension_id": "domain_understanding",
      "direction": "higher_better",
      "metrics": [
        {
          "direction": "pass_fail",
          "evidence": [
            "objective_report.json"
          ],
          "expected": 6.0,
          "metric_id": "objective.observation_count",
          "normalized_score": 100.0,
          "passed": true,
          "reason": null,
          "status": "scored",
          "value": 6.0,
          "weight": 0.065217391304
        },
        {
          "direction": "pass_fail",
          "evidence": [
            "objective_report.json"
          ],
          "expected": 6.0,
          "metric_id": "objective.group_count",
          "normalized_score": 100.0,
          "passed": true,
          "reason": null,
          "status": "scored",
          "value": 6.0,
          "weight": 0.065217391304
        },
        {
          "direction": "pass_fail",
          "evidence": [
            "objective_report.json"
          ],
          "expected": 10.0,
          "metric_id": "objective.water_conversion",
          "normalized_score": 100.0,
          "passed": true,
          "reason": null,
          "status": "scored",
          "value": 10.0,
          "weight": 0.108695652174
        },
        {
          "direction": "pass_fail",
          "evidence": [
            "objective_report.json"
          ],
          "expected": 8.0,
          "metric_id": "objective.water_unit",
          "normalized_score": 100.0,
          "passed": true,
          "reason": null,
          "status": "scored",
          "value": 8.0,
          "weight": 0.086956521739
        },
        {
          "direction": "pass_fail",
          "evidence": [
            "objective_report.json"
          ],
          "expected": 10.0,
          "metric_id": "objective.wet_group_separate",
          "normalized_score": 100.0,
          "passed": true,
          "reason": null,
          "status": "scored",
          "value": 10.0,
          "weight": 0.108695652174
        },
        {
          "direction": "pass_fail",
          "evidence": [
            "objective_report.json"
          ],
          "expected": 8.0,
          "metric_id": "objective.dissolved_family",
          "normalized_score": 100.0,
          "passed": true,
          "reason": null,
          "status": "scored",
          "value": 8.0,
          "weight": 0.086956521739
        },
        {
          "direction": "pass_fail",
          "evidence": [
            "objective_report.json"
          ],
          "expected": 8.0,
          "metric_id": "objective.ugkg_conversion",
          "normalized_score": 100.0,
          "passed": true,
          "reason": null,
          "status": "scored",
          "value": 8.0,
          "weight": 0.086956521739
        },
        {
          "direction": "pass_fail",
          "evidence": [
            "objective_report.json"
          ],
          "expected": 8.0,
          "metric_id": "objective.dry_median",
          "normalized_score": 100.0,
          "passed": true,
          "reason": null,
          "status": "scored",
          "value": 8.0,
          "weight": 0.086956521739
        },
        {
          "direction": "pass_fail",
          "evidence": [
            "objective_report.json"
          ],
          "expected": 8.0,
          "metric_id": "objective.water_median",
          "normalized_score": 100.0,
          "passed": true,
          "reason": null,
          "status": "scored",
          "value": 8.0,
          "weight": 0.086956521739
        },
        {
          "direction": "higher_better",
          "evidence": [
            "llm_grader_report.json"
          ],
          "expected": 8.0,
          "metric_id": "llm.media",
          "normalized_score": 100.0,
          "passed": true,
          "reason": "Solid mass-fraction records stay in mg/kg and water mass-volume records are converted to ug/L; unit spaces remain independent per medium and per-group units are preserved in the summary.",
          "status": "scored",
          "value": 8.0,
          "weight": 0.086956521739
        },
        {
          "direction": "higher_better",
          "evidence": [
            "llm_grader_report.json"
          ],
          "expected": 6.0,
          "metric_id": "llm.basis",
          "normalized_score": 100.0,
          "passed": true,
          "reason": "The wet-basis record M02 is kept in its own soil|wet|total group with identity conversion instead of being disguised as dry basis without moisture content.",
          "status": "scored",
          "value": 6.0,
          "weight": 0.065217391304
        },
        {
          "direction": "higher_better",
          "evidence": [
            "llm_grader_report.json"
          ],
          "expected": 6.0,
          "metric_id": "llm.phase",
          "normalized_score": 100.0,
          "passed": true,
          "reason": "filtered_dissolved is mapped into the dissolved family, original phase values are preserved in the phase column, and dissolved and total phase families are never combined into one comparison group.",
          "status": "scored",
          "value": 6.0,
          "weight": 0.065217391304
        }
      ],
      "score": 100.0,
      "weight": 0.15
    },
    {
      "dimension_id": "innovation_ecosystem",
      "direction": "higher_better",
      "metrics": [
        {
          "direction": "pass_fail",
          "evidence": [
            "objective_report.json"
          ],
          "expected": true,
          "metric_id": "innovation_ecosystem.missing_evidence",
          "normalized_score": null,
          "passed": null,
          "reason": "No frozen metric evidence was supplied for this E1 dimension.",
          "status": "not_scored",
          "value": null,
          "weight": 1.0
        }
      ],
      "score": 0.0,
      "weight": 0.1
    },
    {
      "dimension_id": "open_source_potential",
      "direction": "higher_better",
      "metrics": [
        {
          "direction": "pass_fail",
          "evidence": [
            "objective_report.json"
          ],
          "expected": true,
          "metric_id": "open_source_potential.missing_evidence",
          "normalized_score": null,
          "passed": null,
          "reason": "No frozen metric evidence was supplied for this E1 dimension.",
          "status": "not_scored",
          "value": null,
          "weight": 1.0
        }
      ],
      "score": 0.0,
      "weight": 0.06
    }
  ],
  "eval_version": "1.0.0",
  "evidence": [
    "llm_grader_report.json",
    "objective_report.json"
  ],
  "hard_gate_passed": true,
  "rubric_sha256": "821274b0d4c8920811e3034c26b13977b5501bbba632a596f9a88ae329344d4d",
  "run_id": "regression-q09-independent-review",
  "schema_version": "1.0.0",
  "score_status": "partial",
  "scorer_version": "6.0.0",
  "total_score": 45.0
}
