{
  "candidate_status": "success",
  "checks_path": "objective_report.json",
  "computed_at": "2026-08-06T15:05:20.076440Z",
  "contract_sha256": "b113743f47bbea4f3df8e13c93961071d1a1787243c1a857b4226b79c8acc4ee",
  "dimensions": [
    {
      "dimension_id": "scientific_credibility",
      "direction": "higher_better",
      "metrics": [
        {
          "direction": "higher_better",
          "evidence": [
            "llm_grader_report.json"
          ],
          "expected": 7.0,
          "metric_id": "llm.conflict",
          "normalized_score": 71.428571,
          "passed": false,
          "reason": "Both conflicting S07 records are kept, both flagged sample_coordinate_conflict, and both suspended from mapping (eligible_map=False), so no silent single-record pick (checks p07a_conflict, p07b_conflict passed). 2 points withheld because no artifact text states the need to trace back to the source; the CSV contains no explanation field.",
          "status": "scored",
          "value": 5.0,
          "weight": 1.0
        }
      ],
      "score": 71.428571,
      "weight": 0.25
    },
    {
      "dimension_id": "engineering_quality",
      "direction": "higher_better",
      "metrics": [
        {
          "direction": "pass_fail",
          "evidence": [
            "objective_report.json"
          ],
          "expected": 5.0,
          "metric_id": "objective.output_exists",
          "normalized_score": 100.0,
          "passed": true,
          "reason": null,
          "status": "scored",
          "value": 5.0,
          "weight": 1.0
        }
      ],
      "score": 100.0,
      "weight": 0.3
    },
    {
      "dimension_id": "platform_reusability",
      "direction": "higher_better",
      "metrics": [
        {
          "direction": "pass_fail",
          "evidence": [
            "objective_report.json"
          ],
          "expected": 8.0,
          "metric_id": "objective.columns",
          "normalized_score": 100.0,
          "passed": true,
          "reason": null,
          "status": "scored",
          "value": 8.0,
          "weight": 1.0
        }
      ],
      "score": 100.0,
      "weight": 0.14
    },
    {
      "dimension_id": "domain_understanding",
      "direction": "higher_better",
      "metrics": [
        {
          "direction": "pass_fail",
          "evidence": [
            "objective_report.json"
          ],
          "expected": 5.0,
          "metric_id": "objective.row_count",
          "normalized_score": 100.0,
          "passed": true,
          "reason": null,
          "status": "scored",
          "value": 5.0,
          "weight": 0.0625
        },
        {
          "direction": "pass_fail",
          "evidence": [
            "objective_report.json"
          ],
          "expected": 6.0,
          "metric_id": "objective.p01_valid",
          "normalized_score": 100.0,
          "passed": true,
          "reason": null,
          "status": "scored",
          "value": 6.0,
          "weight": 0.075
        },
        {
          "direction": "pass_fail",
          "evidence": [
            "objective_report.json"
          ],
          "expected": 6.0,
          "metric_id": "objective.p02_lat",
          "normalized_score": 0.0,
          "passed": false,
          "reason": "coordinate_qc.csv key={'record_id': 'P02'} column=qc_flags actual='latitude_out_of_range;possible_lat_lon_swap' expected='latitude_out_of_range' tol=0.0",
          "status": "scored",
          "value": 0.0,
          "weight": 0.075
        },
        {
          "direction": "pass_fail",
          "evidence": [
            "objective_report.json"
          ],
          "expected": 6.0,
          "metric_id": "objective.p03_lon",
          "normalized_score": 100.0,
          "passed": true,
          "reason": null,
          "status": "scored",
          "value": 6.0,
          "weight": 0.075
        },
        {
          "direction": "pass_fail",
          "evidence": [
            "objective_report.json"
          ],
          "expected": 6.0,
          "metric_id": "objective.p04_placeholder",
          "normalized_score": 100.0,
          "passed": true,
          "reason": null,
          "status": "scored",
          "value": 6.0,
          "weight": 0.075
        },
        {
          "direction": "pass_fail",
          "evidence": [
            "objective_report.json"
          ],
          "expected": 8.0,
          "metric_id": "objective.p05_flags",
          "normalized_score": 100.0,
          "passed": true,
          "reason": null,
          "status": "scored",
          "value": 8.0,
          "weight": 0.1
        },
        {
          "direction": "pass_fail",
          "evidence": [
            "objective_report.json"
          ],
          "expected": 5.0,
          "metric_id": "objective.p05_suggestion",
          "normalized_score": 100.0,
          "passed": true,
          "reason": null,
          "status": "scored",
          "value": 5.0,
          "weight": 0.0625
        },
        {
          "direction": "pass_fail",
          "evidence": [
            "objective_report.json"
          ],
          "expected": 5.0,
          "metric_id": "objective.p05_not_mapped",
          "normalized_score": 100.0,
          "passed": true,
          "reason": null,
          "status": "scored",
          "value": 5.0,
          "weight": 0.0625
        },
        {
          "direction": "pass_fail",
          "evidence": [
            "objective_report.json"
          ],
          "expected": 5.0,
          "metric_id": "objective.p06_missing",
          "normalized_score": 100.0,
          "passed": true,
          "reason": null,
          "status": "scored",
          "value": 5.0,
          "weight": 0.0625
        },
        {
          "direction": "pass_fail",
          "evidence": [
            "objective_report.json"
          ],
          "expected": 5.0,
          "metric_id": "objective.p07a_conflict",
          "normalized_score": 100.0,
          "passed": true,
          "reason": null,
          "status": "scored",
          "value": 5.0,
          "weight": 0.0625
        },
        {
          "direction": "pass_fail",
          "evidence": [
            "objective_report.json"
          ],
          "expected": 6.0,
          "metric_id": "objective.p07b_conflict",
          "normalized_score": 100.0,
          "passed": true,
          "reason": null,
          "status": "scored",
          "value": 6.0,
          "weight": 0.075
        },
        {
          "direction": "pass_fail",
          "evidence": [
            "objective_report.json"
          ],
          "expected": 4.0,
          "metric_id": "objective.p08_valid",
          "normalized_score": 100.0,
          "passed": true,
          "reason": null,
          "status": "scored",
          "value": 4.0,
          "weight": 0.05
        },
        {
          "direction": "higher_better",
          "evidence": [
            "llm_grader_report.json"
          ],
          "expected": 8.0,
          "metric_id": "llm.non_destructive",
          "normalized_score": 87.5,
          "passed": false,
          "reason": "Originals are preserved in original_latitude/original_longitude for all rows; swap values appear only in suggested_* columns with flagged rows gated eligible_map=False, so swaps are suggestion-only and held from mapping. 1 point withheld because no artifact explicitly documents routing to human confirmation, and deterministic check p02_lat reports P02's swap flag string as deviating from the expected key.",
          "status": "scored",
          "value": 7.0,
          "weight": 0.1
        },
        {
          "direction": "higher_better",
          "evidence": [
            "llm_grader_report.json"
          ],
          "expected": 5.0,
          "metric_id": "llm.placeholder",
          "normalized_score": 100.0,
          "passed": true,
          "reason": "The 0,0 record is retained (not dropped) with the frozen flag possible_zero_zero_placeholder and eligible_map=False (not auto-accepted); deterministic check p04_placeholder passed, consistent with the artifact row.",
          "status": "scored",
          "value": 5.0,
          "weight": 0.0625
        }
      ],
      "score": 91.25,
      "weight": 0.15
    },
    {
      "dimension_id": "innovation_ecosystem",
      "direction": "higher_better",
      "metrics": [
        {
          "direction": "pass_fail",
          "evidence": [
            "objective_report.json"
          ],
          "expected": true,
          "metric_id": "innovation_ecosystem.missing_evidence",
          "normalized_score": null,
          "passed": null,
          "reason": "No frozen metric evidence was supplied for this E1 dimension.",
          "status": "not_scored",
          "value": null,
          "weight": 1.0
        }
      ],
      "score": 0.0,
      "weight": 0.1
    },
    {
      "dimension_id": "open_source_potential",
      "direction": "higher_better",
      "metrics": [
        {
          "direction": "pass_fail",
          "evidence": [
            "objective_report.json"
          ],
          "expected": true,
          "metric_id": "open_source_potential.missing_evidence",
          "normalized_score": null,
          "passed": null,
          "reason": "No frozen metric evidence was supplied for this E1 dimension.",
          "status": "not_scored",
          "value": null,
          "weight": 1.0
        }
      ],
      "score": 0.0,
      "weight": 0.06
    }
  ],
  "eval_version": "1.0.0",
  "evidence": [
    "llm_grader_report.json",
    "objective_report.json"
  ],
  "hard_gate_passed": true,
  "rubric_sha256": "633aec8b52c86ebca37938035af42fbdbdc03a69783d284b60a0170b9ebc5859",
  "run_id": "regression-q07-independent-review",
  "schema_version": "1.0.0",
  "score_status": "partial",
  "scorer_version": "6.0.0",
  "total_score": 75.544643
}
